{
  "schema_version": 1,
  "pinghue_version": "7.0.0",
  "run": {
    "started_at": "2026-05-14T18:32:11.420Z",
    "ended_at": "2026-05-14T18:32:11.500Z",
    "host": "local",
    "exit_reason": "completed",
    "samples_window": 1000,
    "probe": {
      "mode": "icmp",
      "port": null,
      "interval_s": 1.0,
      "timeout_s": 1.0,
      "address_family": "auto"
    }
  },
  "targets": [
    {
      "target": "1.1.1.1",
      "resolved_address": "1.1.1.1",
      "resolved_family": "ipv4",
      "status": "healthy",
      "error": null,
      "stats": {
        "sent": 1,
        "received": 1,
        "loss_pct": 0.0,
        "min_ms": 9.2,
        "avg_ms": 9.2,
        "max_ms": 9.2,
        "jitter_ms": null
      },
      "samples": [
        {
          "timestamp": "2026-05-14T18:32:11.420Z",
          "latency_ms": 9.2,
          "status": "ok",
          "error": null
        }
      ]
    }
  ]
}
